Chesapeake Bay Retriever,"The Chesapeake Bay Retriever dog breed originated as a water dog used to hunt and retrieve ducks in the chilly chop of Maryland’s Chesapeake Bay. The dog’s sturdy build, dense coat, stamina, and strength made him ideal for this purpose. Today, he’s still known as a fine hunting dog as well as a wonderful companion for active, experienced dog owners who can give him the structure and exercise he needs.",L,,,,,,,,,
Chi-Poo,"The Chi-Poo is a mixed breed dog–a cross between the Chihuahua and Toy or Teacup Poodle dog breeds. Compact, energetic, and great with kids, these pups inherited some of the best qualities from both of their parents.

Chi-Poos go by several names, including Choodle, Chipoodle, Poochi, and Poohuahua. Despite their unfortunate status as a designer breed, you can find these mixed-breed dogs in shelters and breed-specific rescues, so remember to adopt! Don’t shop!


These adorable pups are quite versatile. They make great apartment dogs for people with active lifestyles and do well in big or small houses with a yard or without. If you want an energetic dog who doesn’t require a ton of exercise and will also act as a guard dog, alerting you to any potential dangers and visitors, the Chi-Poo may be the right dog for you.",L,,,,,,,,,
Chihuahua,"The Chihuahua dog breed‘s charms include their small size, big personality, and variety in coat types and colors.

Chihuahuas are all dog, fully capable of competing in dog sports such as agility and obedience, and are among the top ten watchdogs recommended by experts.",L,,,,,,,,,
Chilier,"The Chilier is a mixed breed dog–a cross between the Chihuahua and Cavalier King Charles Spaniel dog breeds. Friendly, sociable, and affectionate, these pups inherited some of the best traits from both of their parents.

The Chilier is sometimes also known as the Cavachi. You can find these mixed breed dogs in shelters and breed specific rescues, so remember to always adopt! Don’t shop if you’re looking to add one of these pups to your home!


This mixed breed has a fine reputation for being a very family-focused dog who enjoys being around people and will bond with the members of your family very quickly. They’re also relatively laid back and calm. Due to their small size, they can usually adapt to living in apartment situations; although, they definitely prefer to have access to a safe and fenced-in outdoor space. If you’re thinking of adopting a Chilier, just be aware that they often have a very strong independent streak that comes from their Chihuahua side, and it can result in the dog being harder than usual to train.",S,,,,,,,,,
Chinese Crested,"The Chinese Crested dog breed was created to be an invalid’s companion. In that setting, you won’t find a better dog. They can almost read your mind and will lie in bed for hours without moving a muscle. They have almost no desire to go out and run around like regular dogs, although they are athletic enough to jump surprisingly tall fences and compete in agility. Chinese Cresteds are not gregarious, but they are intensely social and bond quickly within their pack. They don’t accept strangers easily. Once it falls in love with you, you’ll have a little stalker on your hands — he’ll be eternally, thoroughly devoted.",S,,,,,,,,,
Chinese Shar-Pei,"Though the Chinese Shar-Pei is the 134th breed recognized by the American Kennel Club, the dog breed has been around for hundreds of years. He was developed to guard, hunt, herd, and later, fight, and is known for his characteristic short, bristly coat, loose, wrinkled skin, and devotion to his family. Today, the Shar-Pei mostly enjoys life as a beloved companion.",M,,,,,,,,,
Chinook,"Created in the White Mountains of New Hampshire, the Chinook dog breed made his name on Admiral Byrd’s first Antarctic expedition in 1928. These days he’s a multipurpose dog who’s happy hiking, competing in agility and other dog sports, pulling a sled or other conveyance, and playing with the kids.",L,,,,,,,,,
Chipin,"The Chipin is a mixed breed dog–a cross between the Chihuahua and Miniature Pinscher dog breeds. Compact, happy, and fast learners, these pups inherited some of the best qualities from both of their parents. Parental breed research can offer much insight into their temperament and behaviors.

Chipins go by a few names, including Pinhuahua and Minchi. Despite their unfortunate status as a “designer” breed, you can find these mixed dogs in shelters and breed specific rescues, so remember to adopt! Don’t shop!


These adorable pups make great apartment dogs for active urban dwellers and families, though they have a tendency to be yappy. If you want an energetic “spirited” dog who will keep you on your toes, alert you to any potential dangers, and love you unconditionally, the Chipin may be your new best friend.",S,,,,,,,,,
Chiweenie,"The Chiweenie is a mixed breed dog–a cross between the Chihuahua and Dachshund dog breeds. Compact, energetic, and loyal, these pups inherited some of the best traits from both of their parents.

Chiweenies go by several names, including Choxie, Weeniehuahua, the German Taco, and the Mexican Hot Dog. Despite their unfortunate status as a designer breed, you can find these mixed-breed dogs in shelters and breed specific rescues, so remember to adopt! Don’t shop!

These adorable pups make great apartment dogs for active urban dwellers, though they are best suited to small or single-person households, and they have a tendency to be yappy. If you want an energetic “firecracker” dog who will keep you on your toes, alert you to any potential dangers, and love you unconditionally, the Chiweenie may be the right dog for you!",S,,,,,,,,,
Chow Chow,"This distinctive-looking dog breed has a proud, independent spirit that some describe as catlike. He can be aloof — if you’re looking for a cuddle buddy, this probably isn’t the best breed for you — and downright suspicious of strangers. But for the right person, he’s a fiercely loyal companion.",M,,,,,,,,,
Chug,"The Chug is a mixed breed dog–a cross between the Chihuahua and the Pug. Playful, loyal, and small, the Chug has some of the best traits of both of their compact, loving parents.

Chugs go by several other names, like the Chihuahua Pug mix, Pughuahua, and Pugwawa. Even though they’re sometimes unfortunately thought of as a designer dog, the good news is there are plenty of Pug Chihuahua mixes available for adoption. You can always check a breed-specific rescue if you are specifically looking for a Chug. Remember to adopt! Don’t shop!


Despite their tiny stature, these dogs have big personalities. They like to think that they are actually large dogs, and will act as such. Anyone who is thinking about getting this mixed breed should be ready for an energetic pup who requires a lot of attention. This makes them great family pets, but smaller children learn how to safely play with the small Chug. Fortunately, with some training, you can keep your Chug from getting too territorial, resource-guarding, or snapping if play with a tiny human accidentally gets too intense.",S,,,,,,,,,
Chusky,"The Chusky is a mixed breed dog — a cross between the Chow Chow and Siberian Husky dog breeds. Curious, headstrong, and loving, these dogs inherited some of the best qualities from both of their parents.

Chuskies go by several different names, including Chow Husky, Husky Chow, and Chowski. Despite their unfortunate status as a designer breed, you can find these mixed-breed dogs in shelters and breed specific rescues, so remember to adopt! Don’t shop!


These adorable, fluffy dogs are intelligent and somewhat stubborn, which doesn’t make them ideal matches for novice owners. They can also grow very protective of their owners and make excellent watch dogs. If you want a smart dog who enjoys training, lots of exercise, and of course, lots of cuddles, then the Chusky might be the right dog for you.",M,,,,,,,,,
Clumber Spaniel,"The Clumber Spaniel dog breed was originally created to find and retrieve game birds for hunters. Today, there is an effort to re-establish the Clumber Spaniel as an exceptional gundog, and many Clumber Spaniels compete in field trials. They can also be found in the show ring and competing in tracking, obedience, rally, and other dog sports. Last, but definitely not least, they make super family companions.",L,,,,,,,,,
Cockalier,"The Cockalier is a mixed breed dog–a cross between the Cavalier King Charles Spaniel and Cocker Spaniel dog breeds. Friendly, gentle, and intelligent, these pups inherited some of the best traits from both of their parents.

You can find these mixed breed dogs in shelters and breed specific rescues, so remember to always adopt! Don’t shop if you’re looking to add a Cockalier to your home!


The Cockalier is one of the most affectionate and loving dog breeds around. They are loving and loyal and will quickly form lifelong bonds with any humans who show them love and kindness. They are intelligent and usually take well to training, making them an ideal option for first time dog owners.

While the Cockalier is a high energy canine, they can also adapt to living in apartments or smaller spaces–as long as enough exercise is provided. If you’ve looking for a loyal and loving dog with a great temperament, definitely consider adopting a Cockalier.",S,,,,,,,,,
Cockapoo,"An adorable, small dog with the personality of a big clown, the Cockapoo is the first of the “designer dogs” (not a “pure” dog breed), dating back to the 1960s, rather than to just a few years ago. Completely people-oriented, the Cockapoo is intelligent enough to train easily, hardly sheds, forgives quickly, and is so affectionate that you’ll never feel alone. You might even have to shut the bathroom door for a minute of privacy. They’re happy running around an agility course, showing off their tricks to company, being petted as a therapy dog, or just hanging out on your lap. Your lap is theirs, by the way.",L,,,,,,,,,
Cocker Spaniel,"The Cocker Spaniel is primarily a beloved companion dog breed, though he remains a capable bird dog at heart. Beautiful to look at (and labor-intensive to groom), the Cocker’s amenable, cheerful disposition also makes him a treat to have in the family. Never more pleased than when he’s pleasing you, he’s as happy to snuggle on the couch with his favorite adults as to romp in the yard with the kids.",M,,,,,,,,,
Collie,"The Collie dog breed is a native of Scotland, mostly of the Highland regions but also bred in the Scottish Lowlands and northern England, where she was used primarily as a herding dog. She is a sensitive and intelligent dog, known for her undying loyalty and amazing ability to foresee her owner’s needs. She is a great family companion, and is still a capable herding dog.",M,,,,,,,,,
Corgi Inu,"The Corgi Inu is a mixed breed dog–a cross between the Shiba Inu and the Corgi dog breeds. With the adorable looks of a fox, these vigilant, affable pups inherited some of the best qualities from both of their parents.

Corgi Inus go by several names, including the Shiba Corgi or simply the Corgi Shiba Inu mix. Despite their unfortunate status as a designer breed, you can find these mixed-breed dogs in shelters and breed specific rescues, so remember to adopt! Don’t shop!


These adorable pups are incredibly alert, which makes them a great choice for anyone looking for a watch dog. This also makes them an excellent dog for singles living in active urban areas, seniors, or families with older children who know how to properly interact with dogs. If you’re looking for a highly trainable, independent companion, the Corgi Inu just might be the perfect dog for you!",S,,,,,,,,,
Corgidor,"The Corgidor is a mixed breed dog–a cross between the Corgi and Labrador Retriever dog breeds. Mid-sized, even tempered, and energetic, these pups inherited some of the best traits from both of their parents.

They often look similar to a Labrador with short legs. Despite their unfortunate status as a designer breed, you can find these mixed-breed dogs in shelters and rescues, so remember to adopt! Don’t shop!


Corgidors would make great additions to almost any family with a moderate-to-active lifestyle. Also, if you like the outdoors, this pup may be your new favorite companion. They’re easygoing, good-natured, and loyal to a fault.",M,,,,,,,,,
Coton de Tulear,"Sweet and cuddly dog breed with a clownish personality, the Coton de Tulear is always ready for a good time. This smart little dog with the cottony coat originated in Madagascar and is related to the Bichon Frise and the Maltese.",S,,,,,,,,,
Curly-Coated Retriever,"Created to retrieve game from land or water, the Curly-Coated Retriever dog breed was popular with English gamekeepers, hunters, and poachers alike. Today he competes in such dog sports as field trials, agility, obedience, and flyball and has been successful as a therapy dog, drug detection dog, and search and rescue dog. When he’s not out working or competing, he’s happy to lie beside his favorite person, enjoying a nice back scratch.",L,,,,,,,,,
Dachsador,"The Dachsador is a mixed breed dog–a cross between the Dachshund and Labrador Retriever dog breeds. Lively, active, and friendly, these pups inherited some of the best qualities from both of their parents.

Dachsadors are also sometimes known as Doxadors, Doxidors, and Weinerdors. You can find these mixed breed dogs in shelters and breed specific rescues, so remember to always adopt! Don’t shop if you’re looking to add a Dachsador to your home!


The Dachsador is a friendly and super social dog who will be a big hit with families. The breed will seek out human companionship and is always in the mood for cuddle sessions on the couch. A relatively low maintenance dog when it comes to grooming, the Dachsador does have a playful streak that means this high energy mixed breed will require regular exercise. If you’re an active family, this dog will fit in with your routine perfectly.",L,,,,,,,,,
Dachshund,"Dachshunds are scent hound dogs who were bred to hunt badgers and other tunneling animals, rabbits, and foxes. Packs of Dachshunds were even used to trail wild boar.

Today their versatility makes them excellent family companions, show dogs, and small-game hunters.",S,,,,,,,,,
Dalmatian,"Best known as the star of Disney’s 101 Dalmatians, this sleek and athletic dog breed has a history that goes back several hundred years. He started out as a coach dog but has also served in many other capacities, including hunter, firehouse dog, and circus performer. As charming in life as in film, he goes from gallant to goofy to gallant again in the blink of an eye, and loves to be a part of everything his family does.",L,,,,,,,,,
Dandie Dinmont Terrier,"Dandie Dinmont Terriers originally were bred to hunt otter and badger. Nicknamed the gentleman of the terrier family, he is calm and reserved, yet retains his terrier tenacity and love of the hunt. His small size and moderate exercise needs make him well suited to both city and country homes.",S,,,,,,,,,
Deutscher Wachtelhund,"The Deutscher Wachtelhund is a rare purebred dog originating from Germany. Friendly, intelligent, and versatile, this adorable pup has some of the best qualities you can find in any dog breed.

The Deutscher Wachtelhund goes by several other names, including German Spaniel, Deutscher Wachtel, and German Quail Dog. Despite their unfortunate status as a rare breed, you can still sometimes find these pooches in your local shelters or rescues. So remember it’s better to adopt. Don’t shop!


These pups are adaptable and natural hunters, so living somewhere in the rural area or countryside works best for them. They’re also affectionate and friendly, so they’re suited for any type of household or family. Although they are great family dogs, they can get some separation anxiety if left alone for too long. If you want an energetic, capable dog who will keep you on your toes and love you unconditionally, then the Deutscher Wachtelhund may be the right dog for you!",M,,,,,,,,,
Doberdor,"The Doberdor is a mixed breed dog–a cross between the Doberman Pinscher and Labrador Retriever dog breeds. Intelligent, protective, and loyal, these pups inherited some of the best qualities from both of their parents.

Doberdors are also sometimes known as the Labraman. You can find these mixed breed dogs in shelters and breed specific rescues, so remember to always adopt! Don’t shop if you’re looking to add a Doberdor to your home!


Doberdors make excellent guard dogs, and they’ll quickly become loyal and protective towards the humans in their life. But they’re also a super playful breed that requires lots of exercise and playtime. They are not suited for apartment living–ideally you’ll want a safe, fenced in yard and access to off-leash parks. Doberdors also have a reputation for being a little tricky to train, so experienced dog owners fare better with the breed.",L,,,,,,,,,
Doberman Pinscher,"The Doberman Pinscher was developed in Germany during the late 19th century, primarily as a guard dog. His exact ancestry is unknown, but he’s believed to be a mixture of many dog breeds, including the Rottweiler, Black and Tan Terrier, and German Pinscher. With his sleek coat, athletic build, and characteristic cropped ears and docked tail, the Doberman Pinscher looks like an aristocrat. He is a highly energetic and intelligent dog, suited for police and military work, canine sports, and as a family guardian and companion.",L,,,,,,,,,
Docker,"The Docker is a mixed breed dog–a cross between the Dachshund and Cocker Spaniel dog breeds. They range in size from small to medium and enjoy lounging around with intervals of playtime. Fetch, hiking, or squirrel chasing would be ideal. These pups inherited some of the best qualities from both of their parents.

Dockers go by a few other names, including Doxie Spaniel and Spaniel Doxie. Despite their unfortunate status as a designer breed, you can find these mixed-breed, along with every other one, in shelters and breed-specific rescues, so remember to adopt! Don’t shop!


These adorable pups make great family additions. The bigger the family, the better, because they don’t like to be left alone for long stretches. If you want a sweet-natured dog who will also alert you to any potential dangers and enjoy paling around with you, the Docker may be a great choice.",S,,,,,,,,,
Dogo Argentino,"The Dogo Argentino, sometimes called the Argentinian Mastiff or the Argentine Dogo, is a powerful, athletic, and loyal breed that is both a fierce hunter and a gentle protector of its human family. They have a high prey drive, a strong will, and, at times, a distrust of strangers and other animals, all of which require an experienced dog owner to handle the breed.

Dogo Argentino puppies need lots of physical activity and mental stimulation along with patient training, or else they can become bored and destructive. Dogo Argentinos are often used to help with big-game hunting, though they are also trained for police work, search and rescue, military work, and as service dogs.


With proper training and socialization, they can make an excellent family companion and watchdog.",L,,,,,,,,,
Dogue de Bordeaux,"This dog breed‘s most famous member co-starred with Tom Hanks in the 1989 movie, Turner and Hooch. Loyal, self-assured, and territorial, the Dogue de Bordeaux requires lots of training and socialization.",L,,,,,,,,,
Dorgi,"The Dorgi is a mixed breed dog–a cross between the Dachshund and Corgi dog breeds. Loyal, friendly, and intelligent, these pups inherited some of the best qualities from both of their parents.

Dorgis are also known as the Dorgie on occasion. You can find these mixed breed dogs in shelters and breed specific rescues, so remember to always adopt! Don’t shop if you’re looking to add a Dorgi to your home!


Dorgis make excellent family pets–and their adorable and unique look makes them eye-catching walking companions when you’re out and about. The diminutive breed is loving and loyal and enjoys being around small children. Although be warned: These are energetic dogs, and you’re going to need to commit to appropriate levels of exercise or live in a space with outdoor access.",S,,,,,,,,,
Doxiepoo,"If you were the type of kid who wasn’t afraid to choose the “mystery” flavor of candy in a bag, a Dachshund Poodle–or Doxiepoo–may be for you. While this mixed breed can have famously endless combinations, they are known for being affectionate, intelligent, and playful.

The list of names the Doxiepoo is known by is as long as the parent Dachshund: Doodle, Dachdoodle, Doxiedoodle, Doxiepoodle, Dachshunddoodle, and Dachshundpoo. This is one of the most unpredictable pairings among mixed breeds, even within a single litter, which means they often end up in shelters. However, with such winning personality traits, they are wonderfully adoptable dogs–and, as one of the most loving mixed breeds, they will fall in love with you before you leave the shelter.


Because they’re so affectionate and loyal, Doxiepoos work best with families who don’t mind spending plenty of time with them. They do well with children, but they do best in single-pet homes. Vigilant watchdogs, Doxiepoos may be “yappy,” so owners should be prepared. Also, because it’s impossible to know how this mix may turn out, owners who need “hypoallergenic” dogs should probably stay away from this mixed breed. Doxiepoos are energetic but highly adaptable to both apartments and houses, provided they are given enough exercise time.",S,,,,,,,,,
Doxle,"A cross between Dachshund and Beagle breeds, the Doxle is an adorable family watchdog. Affectionate, playful, and inquisitive, Doxles combine some of the best characteristics of both parents.

Doxles are also known as Beaschunds, Beweenies, and Doxies. Despite their status as a “designer breed,” you can find Doxles at breed-specific rescues and shelters. So please opt to adopt!


These sweet pups would make a great addition to a home where their affection can be reciprocated–they don’t like to be left alone for long periods of time. That, plus their high level of energy and need for lots of exercise makes them a better fit for people who have time in their schedules to be home for a good portion of the day. They do well with other dogs, but because both parent breeds are hunting dogs, you’d do best not to incorporate smaller animals, especially of prey size.",S,,,,,,,,,
Drentsche Patrijshond,"The Drentsche Patrijshond is a purebred dog hailing from the Netherlands. Intelligent, loyal, and sensitive, these pups have some of the best qualities of any dog breed.

Drentsche Patrijshonds go by several other names, including Dutch Partridge Dog and Drent. You may find these beautiful and versatile purebred dogs in your local shelters and breed specific rescues. Remember that it’s always better to adopt and not shop!


These great pooches make excellent all-around pets. They’re able to live with urban dwellers in city apartments but are better suited for bigger homes with a yard so they can expend their energy. From single-person households to larger sized families, these pups fit in with anyone. If you want a loyal companion who loves to please, then the Drentsche Patrijschond might be just right for you!",L,,,,,,,,,
Drever,"The Drever is a purebred dog from the country of Sweden. Loyal, hardworking, and alert, these pups have some of the best qualities of any dog around.

Drevers go by one other name, which is Swedish Dachsbracke. Despite being from the country of Sweden, you might be able to find this purebred at your local shelter or breed specific rescues nearby. Remember, it’s always better to adopt and not shop!


These hardworking pooches can make great apartment dogs for active urban dwellers, though, with their high energy, they’re better suited for larger homes with yards where they can run around. These pups can get along well with single-person households or larger families. If you want an alert and loyal pup who won’t leave your side, then the Drever might be the perfect dog breed for you!",M,,,,,,,,,
Dutch Shepherd,"Originally used by shepherds in the Netherlands for all-around farm work, the Dutch Shepherd is an intelligent, highly trainable jack-of-all-trades. In modern times, they are used as police dogs, service animals, and family-friendly companions.

You may take a look at the Dutch Shepherd and notice a striking resemblance to German Shepherds or Belgian Shepherds. That’s because these cousin breeds share a close ancestry and only diverged a little over a hundred years ago. While Dutch Shepherds are more rare than many other shepherd breeds, they are known to be some of the healthiest and easiest to train.


They come in three different kinds of coats that are beautifully brindle. If you want a dog that will do well in competitions, act as a watchdog, keep you active, love your family, and provide loyal, affectionate, obedient companionship, you’d get all of the above and more in a Dutch Shepherd.",L,,,,,,,,,
English Cocker Spaniel,"English Cockers are a medium-size dog breed with long ears and a happy disposition. The name Cocker comes from their use to hunt woodcock in England, although English Cockers have been used to hunt many other types of birds as well. They make great companion dogs for people who can give them the exercise they need.",M,,,,,,,,,
