Afador,"The Afador is a mixed breed dog–a cross between the Afghan Hound and Labrador Retriever dog breeds. Loyal, energetic, and affectionate, these pups inherited some of the best qualities from both of their parents.

Afadors are also sometimes known as the Afghan Lab. You can find these mixed breed dogs in shelters and breed specific rescues, so remember to always adopt! Don’t shop if you’re looking to add an Afador to your home!


Afadors make excellent family pets, although they do better with older children and seasoned dog owners who can give the breed the training and attention they require. Afadors also make for good guard dogs, and they’re alert to strangers. The mixed breed is very energetic and athletic, so access to a safe outdoor space is preferred.",L,,,,,,small,medium,large,big
Alaskan Klee Kai,"Small, smart, and energetic, the Alaskan Klee Kai is a relatively new breed that looks like a smaller version of the Siberian Husky, and even the name “Klee Kai” comes from an Inuit term meaning “small dog.”

While Alaskan Klee Kais may resemble larger Husky breeds, they have some key differences, especially when it comes to temperament, that distinguish it from its ancestor working class dogs of the north. This breed is more suited to the life of a companion, though the Alaskan Klee Kai shares the high energy of the Huskies and demands plenty of exercise.


They also tend to be shy around strangers and are prone to expressing their emotions with whines and barks. An inexperienced owner would find it difficult to take on the challenge of caring for an Alaskan Klee Kai, but for an owner who keeps up with training and physical activity, this breed is sweet, loyal, and happy to shower loved ones with affection.",S,,,,,,,,,
Alaskan Malamute,"The Alaskan Malamute features a powerful, sturdy body built for stamina and strength. It reigns as one of the oldest dog breeds whose original looks have not been significantly altered. This intelligent canine needs a job and consistent leadership to avoid becoming bored or challenging to handle.

Novice owners, beware. Dogs of this breed are sensitive and need plenty of companionship and open space. They are not well-suited to apartment life, and they are certainly high-shedding pooches who need plenty of grooming to keep their coats healthy. Expect to clean up dog hair all year long, and especially during shedding season. Alaskan Malamutes are high-energy dogs, and therefore require vigorous exercise. If you plan to leave them home while you’re at work, you may see some anxious, destructive behavior. A dog walker or pet sitter during the day is practically a must if you can’t be home, yourself. An Alaskan Malamute will do well with an experienced owner, lots of open space to roam and burn off energy, and a cooler climate. However, if you can meet this breed’s needs, you’ll have an intelligent, highly-trainable, loving companion for life.",L,,,,,,,,,
American Bulldog,"The American Bulldog is stocky and muscular, but also agile and built for chasing down stray cattle and helping out with work on the farm. In fact, some are known to jump six feet or more into the air.

American Bulldogs are intelligent and affectionate, which makes them great, protective family dogs, though they have high exercise needs and require an experienced, active owner. They can vary in appearance, as there are multiple types, including the Bully or Classic type, also known as the Johnson type, the Standard or Performance type, also called the Scott type, and hybrids of the two.

With patient training and care, American Bulldogs can make loving family companions.",L,,,,,,,,,
American English Coonhound,"A descendent of the English Foxhound, this hunting dog breed is known for his speed, endurance, and loud voice in the field. The American English Coonhound will bark and bay at home, too, making him a poor choice if you’ve got nearby neighbors. He needs lots of exercise.",M,,,,,,,,,
American Eskimo Dog,"Called “the dog beautiful” by his admirers, the American Eskimo Dog, or “Eskie,” is a striking fellow with his white coat, sweet expression, and black eyes. He’s a Nordic dog breed, a member of the Spitz family. Eskies are lively, active companion dogs who love to entertain and join in on all family activities. They are outgoing and friendly with family and friends, but reserved with strangers. Although the Eskie is a small dog — 10 to 30 pounds — he has a big-dog attitude.
",S,,,,,,,,,
American Foxhound,"Easygoing, sweet, kind, and loyal, the American Foxhound dog breed belongs to a way of life that has continued for more than two centuries, but he has the potential to be a modern-day companion as well. His stamina and love of running make him a great jogging partner for athletic owners, and his mild nature makes him an excellent family dog, so long as he gets the exercise he craves.
",L,,,,,,,,,
American Leopard Hound,"The American Leopard Hound is a purebred dog whose ancestors came from Mexico by way of Spanish conquistadors who sailed to North America. They are energetic, sociable, and intelligent pooches who possess all-around great qualities.

The American Leopard Hound goes by other names, such as the Leopard Cur, American Leopard, and American Leopard Cur. You can look for this pure breed by checking your local shelters or rescues. Remember it’s best to adopt and not shop!


These sweet pups are natural hunting dogs and have very high energy, which means they do best in homes with yards. They’re able to bond strongly with humans, which makes them well-suited for households of all types, from single pet parents to families with children. If you want an energetic dog who loves to run and keep you on your toes, alerts you to any potential dangers, and adores you completely, the American Leopard Hound may be the right dog for you!",L,,,,,,,,,
American Pit Bull Terrier,"The American Pit Bull Terrier is a companion and family dog breed. Originally bred to “bait” bulls, the breed evolved into all-around farm dogs, and later moved into the house to become “nanny dogs” because they were so gentle around children. Their tenacity, gameness, and courage make them popular competitors in the sports of weight pulling, agility, and obedience competition.",L,,,,,,,,,
American Pugabull,"The American Pugabull is a mixed breed dog–a cross between the American Bull Dog and Pug dog breeds. Medium in size, alert, and loyal, these pups inherited some of the best qualities from both of their parents.

American Pugabulls are also called Bull Pugs. Despite their unfortunate status as a designer breed, you can find these mixed-breed dogs in shelters and breed specific rescues, so remember to adopt! Don’t shop!


These adorable pups fit in nicely with big families and also make great apartment dogs for active urban dwellers They’re loyal and playful yet very protective–if you’re a family member, this pup will not hesitate to protect you. They will alert to any suspicious characters who approach your door. They will also alert you to any non suspicious characters. Socialize them early with people and animals. Read on and find out if the American Pugabull is the right dog for you!",L,,,,,,,,,
American Staffordshire Terrier,"The American Staffordshire Terrier is a muscular breed that is known for being strong for its size, yet loving and affectionate with their human family. American Staffordshire Terriers enjoy nothing more than being with the humans they care about, whether they’re out for a jog, playing in the yard, or cuddling up on the couch.

They are intelligent and eager to please, which makes them highly trainable, though that intelligence means they need mental stimulation, or else they’ll put those strong jaws to use and chew anything they can find out of boredom. American Staffordshire Terriers can also use their strength to pull dog walkers along with ease wherever they want to go if they aren’t trained properly. This means they need a strong, confident trainer who will set boundaries without being overly harsh.

Socialization is also important to help the breed overcome its natural standoffish tendencies when it comes to other animals. This breed loves having a job to do, and they do well in athletic competitions, police work, and obedience training. With proper training, the American Staffordshire Terrier can be a loyal cuddle bug and family companion, as well as a competent working dog.",L,,,,,,,,,
American Water Spaniel,"he American Water Spaniel was bred to be an all-around hunting dog. Specializing in waterfowl, he’s a skilled swimmer who will retrieve from small boats and has a water-resistant double coat. The dog breed has the high energy of a dog born to chase and retrieve game, but given enough exercise, he can also make an great family companion.",S,,,,,,,,,
Anatolian Shepherd Dog,"The Anatolian Shepherd Dog is a native of Turkey, where they were bred as a shepherd’s companion and livestock guardian. They were created with specific traits to resemble the size and color of livestock they defended so predators wouldn’t detect them among the flock. Sometimes called the Anatolian Karabash Dog or Kangal, they’re a fiercely loyal guard dog and a large, impressive dog breed, frequently weighing 120 to 150 pounds at maturity.

Novice owners beware. Not only are dogs of this breed big; they’re known to be stubborn. Anatolian Shepherd Dogs require firm, consistent trainers with experience handling dogs. Also, while grooming requirements are fairly minimal, owners should have the vacuum on standby. Be ready to clean up all the fur they shed throughout the year.


A trained and well-socialized Anatolian Shepherd is a friend and guardian for anyone they consider to be their “flock,” which includes the human members of their family. They are even friendly with their human children, though their size makes it easy for them to knock over a kid during vigorous play. They may also chase other pets or animals if they owners don’t train them properly. Therefore, socialization and behavior training should start early on, ideally in puppyhood. If you’re willing to stay firm with training, you have the strength to handle a large pooch, and you’re willing to put in the time and dedication, an Anatolian Shepherd Dog will be your friend and guardian for life.",L,,,,,,,,,
Appenzeller Sennenhunde,"The Appenzeller originated as an all-around farm dog breed, who stayed busy herding the livestock, guarding the farm, and pulling carts in his native Switzerland. Today’s Appenzellers have still got the energy, smarts, and self-confidence that makes for valuable working dogs — but they’re anything but low-maintenance. Dogs of this breed need lots of exercise, training, and a job to do.",L,,,,,,,,,
Affenpinscher,"Canines in the Affenpinscher dog breed were originally created to be ratters in homes, stables, and shops. Bred down in size, they moved up in the world, becoming ladies’ companions. Today, they are happy, mischievous companion dogs.
",S,,,,,,,,,
Afghan Hound,"The Afghan Hound is elegance personified. This unique, ancient dog breed has an appearance quite unlike any other: dramatic silky coat, exotic face, and thin, fashion-model build. Looks aside, Afghan enthusiasts describe this hound as both aloof and comical. Hailing from Afghanistan, where the original name for the breed was Tazi, the Afghan is thought to date back to the pre-Christian era and is considered one of oldest breeds.",M,,,,,,,,,
Airedale Terrier,"Known as the “King of Terriers,” the Airedale is indeed the largest of all terriers. The dog breed originated in the Aire Valley of Yorkshire, and was created to catch otters and rats in the region between the Aire and Wharfe Rivers. An able sporting dog, he became an ideal working dog as well, proving his worth during World War I. Intelligent, outgoing, and confident, the Airedale possesses a wonderful playful streak that delights his owners.",L,,,,,,,,,
Akita,"The Akita is a large and powerful dog breed with a noble and intimidating presence. They were originally used for guarding royalty and nobility in feudal Japan. These dogs also tracked and hunted wild boar, black bear, and sometimes deer. The Akita does not back down from challenges and does not frighten easily. Consequently, they are fearless and loyal guardians of their families. Yet they are also affectionate, respectful, and amusing dogs when properly trained and socialized.

An Akita is bound to shed quite a bit, and you may be wiping some drool from their face if you bring one home. Certainly, owners should be prepared for some cleanup. Furthermore, they tend to be stubborn and are not overly fond of strangers. While those can be good traits for a watchdog, they will need an experienced trainer if they are to interact with other animals or people. Novices beware. That said, dogs of this breed are faithful companions that will be attached to the right owner for life and shower them with adoration and love. Therefore, if you and your family are up for the challenge and consider adopting an Akita, you’ll have a lifelong friend that won’t let you down.",L,,,,,,,,,
Barbet,This woolly sporting dog breed is fun-loving and smart. The Barbet was bred for retrieving waterfowl for hunters—and has the webbed feet to prove it—but they’re also a talented agility competitor in their native France.,M,,,,,,,,,
Basenji,"Out of Africa, the Basenji dog breed was originally found in the Congo. He uses both scent and sight to hunt and was originally used to flush small game into a hunter’s nets and to control village rodent populations. Clever and endearing, he’s a good companion for the person or family who can stay a step ahead of him.",S,,,,,,,,,
Bassador,"The Bassador is a mixed breed dog–a cross between the Basset Hound and the Labrador Retriever dog breeds. Loyal, sometimes stubborn, and always sniffing around, these pups inherited some of the best qualities from both of their parents.

Bassadors go by several names, including Basset Lab, Basador, and sometimes even Bassetdor. Despite their unfortunate status as a designer breed, you can find these mixed-breed dogs in shelters and breed specific rescues, so remember to adopt! Don’t shop!


Bassadors come from two very different parents, so their perfect living situation will depend on the individual dog. In general, Bassadors love attention, especially from their favorite person, and will need to live in a place with plenty of space to roam. If you want a dog with a very unique look who’s loyal to a fault, the Bassador could be the dog for you!",M,,,,,,,,,
Basset Fauve de Bretagne,"The Basset Fauve de Bretagne is a purebred dog from France. These pups are intelligent, friendly, and active, which are great qualities for a hound dog.

The Basset Fauve de Bretagne also goes by the name Fawn Brittany Basset. If you so happen to want to bring one of these cute and adorable pooches into your home and family, then make sure to check breed specific rescues or your local shelter. Remember, it’s always best to adopt, not shop!

These adorable pups make great apartment dogs due to their size, and they also make great companions for any household type, from singles to large families with children. They might, however, chase after smaller animals or cats in the household. If you want a friendly, intelligent dog who will keep you on your toes, be a great companion, and love you unconditionally, then the Basset Fauve de Bretagne might be the right pooch for you!",M,,,,,,,,,
Basset Hound,"The Basset dog breed was bred for hunting small game such as rabbits and is still used for this purpose in some parts of the country. When he’s not on the trail of a bunny, he’s a laid-back family friend who loves kids.",S,,,,,,,,,
Bavarian Mountain Scent Hound,"The Bavarian Mountain Scent Hound is a purebred dog originally from Germany. These pups are loyal, intelligent, and reserved, which are some of the best qualities for a Hound dog breed.

The Bavarian Mountain Scent Hound goes by a few other names, including Bavarian Mountain Scenthound and Bayerischer Gebirgsschwei. Despite being a very rare breed, you can try and find these adorable pooches in local shelters or breed specific rescues, so remember to adopt! Don’t shop!


These reserved pups are very loyal to their pet parents and would fit great with families with children or larger households. They are a quiet breed but are very wary towards strangers or anyone theydon’t know approaching them or their humans. If you want a loyal pup who likes to be active and will love you unconditionally, the Bavarian Mountain Scent Hound may be the right dog for you!",L,,,,,,,,,
Beagle,"Small, compact, and hardy, Beagles are active companions for kids and adults alike. Canines in this dog breed are merry and fun loving, but being hounds, they can also be stubborn and require patient, creative training techniques. Their noses guide them through life, and they’re never happier than when following an interesting scent. The Beagle originally was bred as a scenthound to track small game, mostly rabbits and hare. He is still used for this purpose in many countries, including the United States.",S,,,,,,,,,
Bearded Collie,"The Bearded Collie dog breed was developed in Scotland to herd sheep and cattle in any weather or terrain. They function today as excellent family companions, show dogs, working sheepdogs, or even all three. Because of their energy and quickness they are well suited to competing in obedience, rally, agility, and other dog sports.",M,,,,,,,,,
Bedlington Terrier,"The Bedlington Terrier dog breed originated as a killer of vermin and poacher’s sidekick. Today Bedlingtons excel as companions and in the show ring. Although they still have excellent hunting instincts, a keen sense of smell, and the will to go to ground, they are rarely used in the field.",S,,,,,,,,,
Belgian Malinois,"Canines of the Belgian Malinois dog breed were originally bred to be herding dogs. Today, they also work as police dogs, protection dogs, and family companions. In the hands of an experienced dog person, they are intense, intelligent and athletic companions.",L,,,,,,,,,
Belgian Sheepdog,"This medium-size herding dog breed originated in Belgium where he was used to herd sheep. He later graduated to police work, and today his versatility makes him suitable for many types of work and dog sports. He’s alert, devoted, and protective.",M,,,,,,,,,
Belgian Tervuren,"Created in Belgium in the late 19th century, the Belgian Tervuren dog breed is often considered to be the most elegant of the four Belgian sheepdogs. He’s intelligent and athletic, making him a versatile performer in any number of activities, including his original job, herding. If you can provide a dog with plenty of exercise, training, and attention, he might be a good choice for you.",L,,,,,,,,,
Berger Picard,"Also known as the Picardy Shepherd, the Berger Picard dog breed is thought to be the oldest of the French sheepdogs.

Their scruffy looks and lively intelligence have won them plenty of fans over the centuries, and more recently, they’re winning movie roles.",L,,,,,,,,,
Bernedoodle,"Clever, goofy, gentle, and loyal. Bernedoodle fans boast that this mixed breed has the best of both worlds from its Bernese Mountain Dog and Poodle parents.

Also known as the Bernese Mountain Poo, Bernedoodles aren’t bred to take home ribbons in dog shows, but are instead meant to be the perfect, loving companions for active owners and families with children.",L,,,,,,,,,
Bernese Mountain Dog,"The Bernese Mountain Dog is an extremely versatile working dog from the farmlands of Switzerland. They were developed to herd cattle, pull carts, and be watchdogs and loyal companions. They are one of four types of Swiss Mountain Dogs, and the only one with long hair. The Bernese Mountain Dog comes from the canton of Bern, hence his name. They’re a large and sturdy dog breed, with a friendly and calm disposition, and they’re also well-suited to conformation, obedience, tracking, herding, and carting competitions.

A novice dog owner might be attracted to this breed’s friendly disposition, intelligence, and highly trainable nature. However, first-time dog owners should beware. The Bernese Mountain Dog’s size and high energy can make handling difficult. Thus, they don’t appreciate being cooped up in apartments all day. They shed a lot, and they tend to need the drool wiped from their faces every once in a while. Dogs of this breed are great watchdogs, but that also means they have a tendency to bark–loudly. They may want to chase smaller animals and play roughly, even though they are quite gentle when fully mature and trained properly.


Although, for an experienced owner who can match the Bernese’s energy, provide open space, keep up with grooming, and dedicate time and effort to training, this breed will show unconditional love and loyalty. A well-trained Bernese makes an excellent companion that will adore the whole family. They love kids and will even greet newcomers to the home warmly, so long as they’ve had adequate socialization training. There aren’t many breeds with a greater predisposition for friendliness. Therefore, if you’re ready for the challenge, you’ll never regret adopting a Bernese Mountain Dog.",L,,,,,,,,,
Biewer Terrier,"The Biewer Terrier is a rare purebred dog created through the occurrence of a recessive piebald gene in two Yorkshire Terriers.  These dogs are friendly, playful, and energetic, which are some of their best qualities.

The Biewer Terrier, pronounced like “beaver,” are also known by the names Biewer à la Pom Pon, Biewer Yorkie, or Biewer Yorkshire. You may be able to find Biewer Terrier dogs at shelter and rescues, so remember to adopt! It’s always better than shopping!


Since these energetic and lovable pups are small in stature, they are great for those who live in apartments or homes with or without backyards. They’re suited for a wide range of households from single and senior citizens to families with children. Biewer Terriers make great companion pets and they generally get along well with children and other pets, though they can be pretty active and have a tendency to be noisy, especially with strangers and dogs they don’t know.",S,,,,,,,,,
Black and Tan Coonhound,"Born in the USA, the outgoing and friendly black and tan coonhound is a versatile companion who shines in the show ring and field. At home, he’s a superb playmate, jogging or walking companion, and bed warmer.",L,,,,,,,,,
Black Mouth Cur,"Energetic, fearless, and strong, the Black Mouth Cur is valued as an all-around working dog bred to help farmers and hunters in the rugged terrain of the southeastern United States.

The breed is capable of herding livestock, providing protection for the home, and tracking game, though it also has a sensitive side that doesn’t respond well to harsh rebukes or punishment.


The Black Mouth Cur loves being around humans and family, and it is excellent with children, though high exercise needs make this breed a poor choice for inexperienced owners or those who are unable to keep up with a demanding energy level, and its tendency to play rough may not be best for children that are very young.

Black Mouth Curs are mostly found in the United States and are a bit rare in other parts of the world. If you’re interested in bringing home one of these strong-yet-sensitive, energetic, family-friendly dogs, check out our adoption page where you can search for adoptable dogs near you by breed.",S,,,,,,,,,
Bloodhound,"The Bloodhound’s ancestors were created in medieval France to trail deer and boar. Today, he’s a highly active and intelligent dog breed whose keen sense of smell has found him a special place in law enforcement and search and rescue. His fans love him for his sweet nature and unique appearance.",L,,,,,,,,,
Blue Lacy,"The Blue Lacy, also called the Lacy Dog, is an energetic, intelligent, and trainable breed that loves having a job to do and a lot of open space to run around. Even though the breed has “Blue” in its name, Blue Lacys can also have red or tri-colored coats, though they all carry the blue color gene. The “Lacy” in the breed’s name does not refer to the dog’s appearance at all, but rather comes from the name of the family that first created the breed.

The Blue Lacy was developed in the 1800s to help with herding, hunting, and ranch work in Texas. These dogs are hardy, adaptable, and able to learn quickly, though their high intensity and energy level make them ill-suited for apartment life or novice owners.


Blue Lacys can make great family dogs and expert watchdogs with firm training, but they are sensitive and don’t respond well to punishment. Socialization should begin early, as Blue Lacys are naturally territorial, not overly trusting of strangers, and have a high prey drive that can cause them to attack smaller animals and pets if they aren’t socialized.

With confident, assertive training that relies on positive reinforcement, dogs of this breed can be loyal, protective, and capable members of the family that are eager to please. Experienced owners that are ready to give this dog a task will be rewarded with a lifelong friend that will rise to any challenge.
",S,,,,,,,,,
Bluetick Coonhound,"Fast and muscular, the Bluetick dog breed stands out for his striking coat. He has a pleasantly pleading expression and a big bawl mouth — meaning he has a long, drawn out bark. Although he’s a hunter first and foremost, the Bluetick can be a fine housedog and loves his people.",L,,,,,,,,,
