Kerry Blue Terrier,"The Kerry Blue Terrier is the quintessential working dog. He hails from County Kerry, Ireland, where he was bred to hunt small game and birds, kill rodents, and herd sheep and cattle. Intelligent and brave, he became a cherished pet as well, displaying fierce devotion to his family or pack. While not a particularly well-known dog breed, the Kerry Blue enjoys a dedicated following of fanciers, thanks to his working abilities and loyal companionship.",M,,,,,,,,,
Komondor," His appearance might make you think he was developed to mop floors, but the Komondor has a long and noble heritage as a flock-guarding dog breed in his native Hungary. He still retains a strong protective instinct and will defend his family and property with his life.",S,,,,,,,,,
Kooikerhondje,"This good-natured hunting dog breed makes an affectionate family companion. Suspected to be an ancestor of the Nova Scota Duck Tolling Retriever, he hails from Holland and was used to lure ducks into traps for hunting or tagging. He still serves as a hunting dog, but also excels at other dog sports such as flyball.",S,,,,,,,,,
Kuvasz,"The Kuvasz is a large, white flock-guarding dog who hails from Hungary. A one-family dog, he’s protective of his people and suspicious of strangers. The Kuvasz thinks for himself and can be challenging to train.",L,,,,,,,,,
Kyi-Leo,"The Kyi-Leo is a mixed breed dog–a cross between the Maltese and Lhasa Apso dog breeds. Playful, lively, and sweet, these pups inherited some of the best qualities from both of their parents.

Kyi-Leos are also known as Maltese Lion Dogs. You can find these mixed breed dogs in shelters and breed-specific rescues, so remember to always adopt! Don’t shop if you’re looking to add a one of these pups to your home!


Kyi-Leos are usually friendly, chatty, and always willing to join in with an upbeat play session, especially if young children are involved. Due to the breed’s long coat, they do require a little extra time and effort in the grooming department. However, they’re also hypoallergenic, so if allergies are an issue, the Kyi-Leo might be the dog for you!",S,,,,,,,,,
Lab Pointer,"The Lab Pointer is a mixed breed dog–a cross between the Labrador Retriever and Pointer dog breeds. Energetic, loyal, and intelligent, these pups inherited some of the best qualities from both of their parents.

Lab Pointers are also sometimes known as Pointerdors. You can find these mixed breed dogs in shelters and breed specific rescues, so remember to always adopt don’t shop if you’re looking to add a Lab Pointer to your home!


The Lab Pointer is a relatively low maintenance dog–but they’re also a very athletic breed that requires a large amount of outdoor space and time. This is a dog that thrives when living with a family based in rural areas rather than being cooped up in an apartment all day. The’re smart and train well, making them a solid option for new dog owners. The’re also a loving and sociable breed who will form strong and lasting bonds with the humans in their life.",L,,,,,,,,,
Labernese,"The Labernese is a mixed breed dog–a cross between the Labrador Retriever and Bernese Mountain Dog breeds. Loving, intelligent, and friendly, these pups inherited some of the best qualities from both of their parents.

You can find these mixed breed dogs in shelters and breed specific rescues, so remember to always adopt don’t shop if you’re looking to add a Labernese to your home!


The Labernese is a larger-than-life breed that makes for an excellent and affectionate family pet. They’re exceptionally friendly and super social–to the point where they might actually develop separation anxiety if they’re left alone for too long. So if you have a bustling family that’s always around and active, the Labernese could be a smart addition to the home. Due to the breed’s size and energy level, they do require a lot of exercise–if you have a jogger in the house, they’ll soon become running buddies.",L,,,,,,,,,
Labmaraner,"The Labmaraner is a mixed breed dog–a cross between the Labrador Retriever and Weimaraner dog breeds. Intelligent, active, and friendly, these pups inherited some of the best qualities from both of their parents.

Labmaraners are also sometimes known as Weimadors. You can find these mixed breed dogs in shelters and breed specific rescues, so remember to always adopt! Don’t shop if you’re looking to add a Labmaraner to your home!


The Labmaraner is a loving and social dog who will be a huge hit with large families. The breed loves human companionship, but they don’t like being left alone for long periods of time, and in some cases, separation anxiety can even take root. The breed does best with an active family with the time and space to involve a dog in most of their activities. While some Labmaraners have been known to display stubborn tendencies, in general they are smart, easy-to-train dogs.",L,,,,,,,,,
Labrabull,"The Labrabull is a mixed breed dog–a cross between the American Pit Bull Terrier and the Labrador Retriever dog breeds. Medium in size, energetic, and loyal, these pups inherited some of the best qualities from both of their parents.

Labrabulls are also called Pitadors. Despite their unfortunate status as a designer breed, you can find these mixed-breed dogs in shelters and breed specific rescues, so remember to adopt! Don’t shop!


These sweet-natured pups are best suited for level two dog parents, so dog owning experience is recommended. While most owners don’t consider them to be yappy, they will alert when people approach your door. If you want a loving, loyal and energetic dog who will protect and love you unconditionally, this mixed breed may be the answer. Read on to find out if the Labrabull is going to be your next fur baby.",M,,,,,,,,,
Labradane,"The Labradane is a mixed breed dog–a cross between the Labrador Retriever and Great Dane dog breeds. Loyal, affectionate, and playful, these pups inherited some of the best qualities from both of their parents.

You can find these mixed breed dogs in shelters and breed specific rescues, so remember to always adopt! Don’t shop if you’re looking to add a Labradane to your home!


Labradanes are renowned for being gentle giants who form loving bonds with adults and children alike. The breed is super social and will always be down to hang out with you. The dog’s extra large size makes them an eye-catching hit with passersby when you’re out for a walk. Just remember that this is a very big dog, and you’re going to need adequate space both inside your home and also outside for exercise.",L,,,,,,,,,
Labradoodle,"t’s not surprising that the Labradoodle has gained such popularity so quickly. Originally developed to be hypoallergenic guide dogs, the first planned crosses of Poodles and Labrador Retrievers were arranged by the Royal Guide Dogs Association of Australia.

The result was a smart and sociable dog who not only possessed a nature appropriate for guide dogs but also had a low-shedding coat. While the hybrid is not yet achieving consistent results in coat or temperament, they’re wildly popular and affectionate dogs.


Some of these mixed breed dogs end up in shelters or rescues, so make sure you adopt! Don’t shop if you want to bring one of these loving, faithful, and adorable mixed breed dogs into your home!",M,,,,,,,,,
Labrador Retriever,"The Labrador Retriever was bred to be both a friendly companion and a useful working dog breed. Historically, they earned their keep as a fisherman’s helper: hauling nets, fetching ropes, and retrieving fish from the chilly North Atlantic.

Today’s Lab is as good-natured and hardworking as their ancestors, and they’re also America’s most popular breed. Modern Labs work as retrievers for hunters, assistance dogs, show competitors, and search and rescue dogs, among other canine jobs.",M,,,,,,,,,
Labrastaff,"The Labrastaff is a mixed breed dog–a cross between the Labrador Retriever and Staffordshire Bull Terrier dog breeds. Athletic, loyal, and intelligent, these pups inherited some of the best qualities from both of their parents.

Labrastaffs are also sometimes known as Staffadors and Staffy Labs. You can find these mixed breed dogs in shelters and breed-specific rescues, so remember to always adopt! Don’t shop if you’re looking to add one of these dogs to your home.

The Labrastaff is a dog with a lot of energy and athletic prowess. If you’re an outdoorsy type of family, this dog will love coming along on errands and trips to parks or hiking areas. They’re loyal to their family and will strike up strong bonds with the kids in a household. True to the dog’s social nature, they don’t enjoy being alone for long periods of time and may get into mischief if you leave them alone at home or in a yard. So ensure family members are around the Labrastaff as much as possible.",M,,,,,,,,,
Labsky,"The Labsky is a mixed breed dog–a cross between the Labrador Retriever and Siberian Husky dog breeds. Active, smart, and loyal, these pups inherited some of the best qualities from both of their parents.

Labskies also go by the name Huskador. Despite their high-end image, you can find these mixed breed dogs in shelters and breed specific rescues, so remember to always adopt! Don’t shop!


These adorable canines make for super loyal and devoted family pets, and they’re usually very easy to train and quick to learn new commands. But a heads up: Labskies are dogs who like to remain active, so be prepared for lots of extra long walks. Often seen as smarter than the average dog, Labskies also benefit from interactive dog toys.",L,,,,,,,,,
Lagotto Romagnolo,"Lagotto Romagnolo means “lake dog from Romagna,” which is a good name for this breed, considering these dogs were originally bred to help hunt waterfowl through the wet marshlands of Romagna in Italy. They are also known as Italian Water Dogs and Romagna Water Dogs. Today, with many of the marshlands of the breed’s homeland drained, these dogs have found a new purpose in truffle hunting. Owners can easily train them to use their super noses for scent work, and Lagottos’ thick coats help them stay warm in fall and winter while protecting them from thorns and debris as they run through forests.

They are the only dogs bred for the specific purpose of truffle hunting in modern times, and their keen sense of smell and natural tendency to dig make them experts at the task. Lagotto Romagnolos can also make loving, active, easygoing household pets with few demands. Their hypoallergenic coats are good for allergy sufferers, though those coats require a good deal of maintenance. So, if you are capable of keeping up with grooming and brushing and you want a dedicated, easily-trained family companion–or someone to help you hunt for delicious truffles–the Lagotto Romagnolo may be a great dog for you.

",M,,,,,,,,,
Lakeland Terrier,Lakeland Terriers were originally bred to hunt and kill the foxes that preyed on sheep during the lambing season in Northern England’s Lake District.,,,,,,,,,,
Lancashire Heeler,"The Lancashire Heeler was once used to drive livestock to market and hunt rats and rabbits at home, but is now a popular companion dog breed in their native Britain.",,,,,,,,,,
Leonberger,"This jumbo-sized dog breed is a mix of Newfie, longhaired Saint Bernard, and Great Pyrenees.

They need a good deal of exercise, attention, and space, but with the right owner, they can be a friend like no other. With their lion-like looks and deep bark, they make for an intimidating watch dog.",,,,,,,,,,
Lhasa Apso,"The Lhasa Apso dog breed is originally from Tibet, where he was a highly regarded watchdog in the palaces and monasteries of his mountainous homeland. Today’s Lhasa is no longer a palace guard but primarily a family companion who loyally protects his family from danger. Though small in stature, the Lhasa is a sturdy and independent dog.",S,,,,,,,,,
Lowchen,"The Lowchen is a toy dog breed that was developed as a companion dog and still finds itself in this role today. Active and smart, they do very well in dog competitions such as obedience and agility, and surpass the expectations that many have for a family companion.",,,,,,,,,,
Maltese,"A dog breed who’s gentle and fearless, the Maltese greets everyone as a friend. His glamorous white coat gives him a look of haughty nobility, but looks can be deceiving. This is a sprightly, vigorous dog who excels not only as a companion but also as a therapy dog and competitor in such dog sports as agility, obedience, rally, and tracking. But most of all, he loves to be with his people.",,,,,,,,,,
Maltese Shih Tzu,"The Maltese Shih Tzu, also known as the Mal-Shi, Malti zu, and the Malt-Tzu, is a dog breed hybrid. One of the few “designer dogs” not originating with a Poodle, and therefore not one of the ubiquitous “Poo” or “Doodle” hybrids, the adaptable Maltese Shih Tzu is an adorable, sweet little guy with a long name. Created with the same goal as the Doodles — to be a small companion who doesn’t shed much and is therefore more appropriate for people with allergies — the Maltese Shih Tzu is a classic cross, a sweet lapdog who likes to play with the kids.",S,,,,,,,,,
Maltipoo,"Not actually a dog breed per se, the Maltipoo is a popular cross of the Maltese and Poodle, known for his fun-loving and affectionate nature. Active and charming, he can fit into all kinds of homes and families: apartment or house, family with kids or elderly single.",,,,,,,,,,
Manchester Terrier,"This lively, spirited dog breed is a true terrier. Bred in Manchester, England, for the common man’s sports of rat killing and rabbit coursing, he’s got game and he loves to show it. The Gentleman’s Terrier (as he is known in Victorian England) is not a sparring dog but loves a good chase, making him a flyball and agility rock star.

Though his looks suggest a miniature Doberman Pinscher or a large Miniature Pinscher, the Manchester Terrier is his own canine. A wee dog with a strong bark, he’s got personality to burn: loyal, hearty, and a terrific watchdog who adores hanging out with his people. Among terriers, the Manchester is known to be one of the more well-mannered and responsive breeds and today spends his time as a terrific companion who can hold up his end of the conversation.",L,,,,,,,,,
Mastador,"The Mastador is a mixed breed dog–a cross between the Mastiff and Labrador Retriever dog breeds. Large, energetic, and lovable, these pups inherited some of the best qualities from both of their parents.

Mastador can also be spelled Mastidor. Despite their unfortunate status as a designer breed, you can find these mixed-breed dogs in shelters and breed-specific rescues, so remember to adopt! Don’t shop!


These are great guard, hunting and family companion dogs. They’d do well in a family home with or without a yard. If you want a wonderful companion dog and family protector to love you unconditionally, read on to find out if this is the right kind of dog for you!",L,,,,,,,,,
Mastiff,"The Mastiff is one of the most ancient types of dog breeds. His ancestor, the molossus, was known 5,000 years ago. Then, he was a ferocious war dog, very different from the benevolent behemoth that he is today. He makes a fine companion for anyone who can accommodate his great size and doesn’t mind a little drool slung here and there.",,,,,,,,,,
Miniature Pinscher,"The Miniature Pinscher dog breed was originally bred in Germany to hunt vermin, primarily rats, in homes and stables. Many people think that the Miniature Pinscher was developed by breeding Dobermans to progressively smaller sizes, and indeed, the Miniature Pinscher looks similar to a Doberman. However, the Min Pin is a distinct and much older breed. Known as the “King of Toys” for his stately appearance and self-assured attitude, the Miniature Pinscher is a fearless, energetic, and alert companion dog who enjoys the company of his family.",S,,,,,,,,,
Miniature Schnauzer,"He a dog breed who’s got it all in one small package: intelligence, affection, an extroverted temperament, humor, and a personality that’s twice as big as he is. Throw in that walrus moustache and quivering enthusiasm, and he’ll make you laugh every day. With a Miniature Schnauzer in the house, you’ll never be alone, not even when you go to the bathroom. He’s got personality-plus, and whether he’s bounding around ahead of you or curled up snoozing on your lap, you’ll never be bored with him around.",,,,,,,,,,
Morkie,"The Morkie is a mixed breed dog–a cross between the Maltese and the Yorkshire Terrier dog breeds. Small, energetic, and super silly, these pups inherited some of the best qualities from both their parents.

This crossbreed is usually referred to as the Morkie, but it is sometimes called the Morkshire Terrier. Despite their unfortunate status as a designer breed, you can find these mixed-breed dogs at shelters and breed-specific rescues. Remember, when you are looking for pets, adopt! Don’t shop!


These adorable dogs make excellent apartment pets for urban dwellers, and they tend to thrive in small or single-person households. Morkies can also be on the yappier side, like their parents. If you want an energetic, loving dog who will always want your attention, the Morkie might be the right dog for you.",,,,,,,,,,
Mudi,"Alert, active, and intelligent, the Mudi (pronounced “moody”) is a highly trainable herding dog capable of performing almost any task well, including watchdog duties, hunting, performing in agility and obedience competitions, search and rescue, and more.

Also known as the Hungarian Mudi, this breed originated in Hungary where it helped shepherds maintain their flocks, and it was often called the “driver dog.” Even today, Mudis are used in Hungary for their herding abilities and are known to help shepherds with flocks of up to 500 sheep.


Even though Mudis have high exercise needs, they can also be calm family companions when they are properly stimulated, both physically and mentally. Train a Mudi with positive reinforcement and don’t rely on punishment or harsh rebukes. If you do, you’ll have a loyal, smart, and loving dog that will protect you and adore you for life.",,,,,,,,,,
Mutt,"A mixed-breed dog is a testament to nature. Without any input — some might say interference — from humans, the mixed breed defies description. Available in all sizes, shapes, colors, and patterns, he might have a long snout or a short nose. He may display prick ears or floppy ones. He could have a stubby tail, spindly legs, a giant spot over his left eye — or all three. A divine inspiration, the mixed breed is gloriously, wonderfully someone else’s design.

And as the ultimate family dog, the mixed breed excels where the purebred lacks. Drawing from a broader, more diverse gene pool, his intensity is softer than his pedigreed cousins, his drives and compulsions mercifully muted. The Mutt’s loyalty, warmth, and deep desire to please, however, remain as fiercely intact as any dog you could choose to create.",,,,,,,,,,
Neapolitan Mastiff,The Neapolitan Mastiff dog breed is a family and guard dog who was developed in southern Italy. Today this massive breed is known as a gentle giant.,,,,,,,,,,
Newfoundland,"The Newfoundland is a large, strong dog breed from — wait for it — Newfoundland. He was originally used as a working dog to pull nets for fishermen and haul wood from the forest. He is a capable and hardworking dog, well suited to work on land or water. He is a strong swimmer and equally strong “pack horse.” Sweet-natured and responsive, he makes a wonderful family companion as well.",L,,,,,,,,,
Norfolk Terrier,"The Norfolk Terrier is what’s considered a “big dog in a small package.” Alert, gregarious, and nimble, he’s a loyal companion with the heart of a working terrier.",,,,,,,,,,
Norwegian Buhund,"Intelligent, independent, and eager to please, the Norwegian Buhund dog breed can handle all kinds of dog jobs and sports with ease.",,,,,,,,,,
Norwegian Elkhound,"This gorgeous dog breed with the wolflike face delights in life. Smart as can be, he also has a wonderful sense of humor. He’ll race you around the kitchen island, reverse directions when you do, and then howl for sheer fun. Bold, energetic, and protective, he makes an excellent watchdog and guardian. Elkhounds are utterly devoted to their families. When you’re upset, this tenderhearted Viking will plop his head on your lap.",,,,,,,,,,
Norwegian Lundehund,"With six toes on each foot—all of them double- or triple-jointed—and an amazing range of motion, this agile dog breed was used to scale cliffs and rob puffin nests of their eggs.

Along with the Norwegian Lundehund’s acrobatic talents, they have a knack for barking and digging, making them a good choice only if you’re prepared to give them lots of supervision and training. They can be very tough to housetrain.",,,,,,,,,,
Norwich Terrier,he Norwich Terrier originated as a ratter on farms but moved up in the world to bolt foxes from their dens during hunts. Today he’s an amusing companion who serves double duty by keeping your home and yard free of rats and other vermin.,,,,,,,,,,
Nova Scotia Duck Tolling Retriever,"The Nova Scotia Duck Tolling Retriever dog breed was created to both lure and retrieve waterfowl. This versatile breed excels in the field and show ring, in obedience and agility, and as a companion to an active family.",,,,,,,,,,
Old English Sheepdog,"The Old English Sheepdog is a large, athletic dog breed with an unmistakable shaggy coat. The Old English Sheepdog was historically a drover, helping farmers drive cattle and sheep to the market. Today, the good-natured Old English Sheepdog enjoys the comfort of home life and still competes in conformation, obedience, agility, and herding trials. He’s an adaptable, intelligent dog with an easygoing disposition.",L,,,,,,,,,
Otterhound,"The large and rough-coated Otterhound was originally bred for hunting otter in England. Built for work, the dog breed has a keen nose and renowned stamina.

They are also playful clowns, friendly and affectionate with their families. This is an uncommon breed, with fewer than ten Otterhound litters born each year in the United States and Canada.",L,,,,,,,,,
Papillon,"The Papillon dog breed descends from the toy spaniels that are frequently portrayed in paintings by the Old Masters, from as far back as the 16th century. He’s highly active and is a wonderful competitor in agility and obedience. His sparkling personality makes him a favorite of all who meet him.",,,,,,,,,,
Peekapoo,A Peekapoo is a wonderful companion dog who will spend his days perched on your lap or sitting by your side. He’s loyal and affectionate and can be quite protective of the people he loves — which tends to be hilarious in such a small dog breed.,,,,,,,,,,
Pekingese,Pekingese were dogs bred for centuries to be the cherished companions of the imperial family of China. Today they are still cherished family companions and show dogs who greet everyone they meet with dignity and grace.,,,,,,,,,,
Pembroke Welsh Corgi,"Originally bred to herd cattle, sheep, and horses, the Pembroke Welsh Corgi is an active and intelligent dog breed. Easy to train and eager to learn, Pembrokes are great with children and other pets, and you can find them in four different coat colors and markings.",,,,,,,,,,
Petit Basset Griffon Vendeen,"The Petit Basset Griffon Vendéen is a small scent hound who has won the hearts of millions. Although the dog breed appears to be designed for winsome cuteness, in actuality, PBGVs are tough hunters who were developed for a specific purpose: to hunt small game in the rough terrain of the Vendeen region of France. The breed is known for a merry and outgoing personality.",S,,,,,,,,,
Pharaoh Hound,"The Pharaoh Hound is an ancient dog breed who has changed little since his development more than 5,000 years ago. He was the dog of kings and may have hunted gazelles with pharaohs, hence his name. This loyal hunting companion later made his way to Malta, where he’s now the national dog.",,,,,,,,,,
Pitsky,"The Pitsky is a mixed breed dog–a cross between the American Pit Bull Terrier and Siberian Husky dog breeds. They range in size from medium to large, they are energetic, and loyal, these pups inherited some of the best qualities from both of their parents.

Pitskies don’t go by any other names–maybe because Hutbull doesn’t have the same ring–just Pitsky or Husky/Pit mix or Pit/Husky mix. Despite their unfortunate status as a designer breed, you can find these mixed-breed dogs in shelters and breed-specific rescues, so remember to adopt! Don’t shop!

These high energy dogs need fast-paced lifestyles. Novice dog parents are not recommended. Pitskies are demanding and high maintenance. If you love Siberian Huskies and American Pit Bull Terriers and have experience with both, then this mixed breed may be a perfect choice for you!",,,,,,,,,,
Plott,This pack-hunting dog breed was developed in North Carolina more than 200 years ago to hunt bear and wild boar. They are still used as hunting dogs today and have proven their worth as pack hunters. They also participate in tracking and other dog sports. Plotts are best suited to life in the country where they have plenty of room to roam.,,,,,,,,,,
Pocket Beagle,"Smaller than the average Beagle dog breed, these compact scenthounds are merry and fun-loving, but they’re still hounds and as such require patience and creative training techniques to overcome their sometimes stubborn nature.",,,,,,,,,,
