English Foxhound,"The English Foxhound was originally a hunting dog breed, designed to pursue foxes in the English countryside. Today he also enjoys life as a family companion and competes in the conformation ring. Many English Foxhounds also compete in Foxhound Performance Trials, which grade the dogs on their pack hunting skills.",M,,,,,,,,,
English Setter,"The English Setter dog breed was named for its practice of “setting,” or crouching low, when it found birds so the hunter could throw his net over them. After the development of the gun, the dog was developed so he would stand in the more traditional Pointer style. The English Setter is still used as a hunting dog today as well as a family companion.",L,,,,,,,,,
English Springer Spaniel,"The English Springer Spaniel dog breed was developed as a gun dog to flush, or spring, game in the field, but he’s also a popular companion. Athletic and versatile, he’s been known to participate in agility, hunt tests, tracking, obedience trials and more, and he’s a great pal to have along when you go hiking or camping.",M,,,,,,,,,
English Toy Spaniel,"Nicknamed “Charlies” after the king who loved them, English Toy Spaniels are quieter and more reclusive than their Cavalier cousins, but they can have a mischievous spark. They tend to prefer a single person and are not a “hail fellow, well met” type of dog breed.",S,,,,,,,,,
Entlebucher Mountain Dog,"The Entlebucher Mountain Dog has the independent spirit of other herding breeds, but still relishes spending time with his people — especially if they give him a job to do. He can be territorial and will bark to warn you of visitors.",M,,,,,,,,,
Eurasier,"The Eurasier is a breed of medium-sized dogs of the Spitz type that first came from Germany. These dogs are known to be very intelligent, loyal, and even-tempered.

Eurasiers can go by many other names such as Eurasian, Eurasian Spitz, Eurasian dog, and most notably, Wolf-Chow. You can find Eurasier dogs in shelters and breed specific rescues, so remember to adopt!


These dogs are very solid watchdogs and pack-oriented, which makes them ideal for those with families and even kids. However, Eurasiers don’t do well when left alone, especially in a room by themselves. They do best when they are part of a family and, when left on their own, can grow anxious and depressed.",S,,,,,,,,,
Field Spaniel,"The sturdy, medium-sized Field Spaniel dog breed was originally developed to retrieve game from land or water. Today, while he retains his excellent hunting skills, he is mainly a family companion and show dog and is rarely seen in the field. He loves people and is a loyal family friend.",S,,,,,,,,,
Finnish Lapphund,"Believe it or not, this hard-working dog breed earned his keep herding reindeer in his native Lapland, in the far north of",M,,,,,,,,,
Finnish Spitz,"Finnish Spitz were originally were bred to hunt a variety of small and large game, and then bark when they found something. Today they’re considered “talkative” companions who will keep you apprised of just about everything going on in your surroundings.",S,,,,,,,,,
Flat-Coated Retriever,"The Flat-Coated Retriever was originally developed as a dual-purpose retriever of game on land and from water, and he’s still popular for that purpose today. He also competes in obedience, rally, and agility, is a super therapy dog, and is an ideal companion for people who are looking for an active dog breed.",M,,,,,,,,,
Fox Terrier,"Fox Terriers were originally bred to flush foxes out of their hiding places during fox hunts. Today they’re primarily family companions and show dogs, although you’ll occasionally find them in the hunt country of the northeastern United States, still performing their traditional role.",S,,,,,,,,,
French Bulldog,"The French Bulldog has enjoyed a long history as a companion dog. Created in England to be a miniature Bulldog, he accompanied English lacemakers to France, where he acquired his Frenchie moniker. Besides being a companion, he once served as an excellent ratter, but today his job focuses on being a fabulous family friend and show dog. He’s a rare dog breed, so expect to put in some time on a waiting list before you’re able to bring one home.",S,,,,,,,,,
French Spaniel,"The French Spaniel is a pure breed dog from France and Canada. These dogs are sociable, intelligent, and gentle, which make up some of the best qualities in any pooch.

The French Spaniel goes by several names, including Epagneul Francais, French Setter, and Canadian Setter. Despite their unfortunate status as a designer breed, you can find these pure breed dogs in shelters and rescues, so remember to adopt! Don’t shop!


These beautiful dogs make great companions for those who are naturally active. They are not well-suited for apartment living as they need space to run and expend their energy. They are great pets for any type of household, including families with children of all ages. If you want an energetic and active dog who will keep you on your toes, then this breed might be right for you!",M,,,,,,,,,
German Pinscher,"The German Pinscher dog breed is muscular and agile, powerful yet graceful. A medium-sized dog with an elegant appearance, he’s admired as much for his beauty as for his intelligence. He’s a working breed and guard dog, and a devoted and loving family dog.",S,,,,,,,,,
German Shepherd Dog,"The German Shepherd Dog is one of America’s most popular dog breeds—for good reason.

They’re intelligent and capable working dogs. Their devotion and courage are unmatched. And they’re amazingly versatile, excelling at most anything they’re trained to do: guide and assistance work for the handicapped, police and military service, herding, search and rescue, drug detection, competitive obedience, and–last but not least–faithful companion.",L,,,,,,,,,
German Sheprador,"The German Sheprador is a mixed breed dog–a cross between the German Shepherd and Labrador Retriever dog breeds. Large, energetic, and loyal, these pups inherited some of the best qualities from both of their parents.

The German Sheprador is also called the Labrashepherd. Despite their unfortunate status as a designer breed, you can find these mixed-breed dogs in shelters and breed-specific rescues, so remember to adopt! Don’t shop!


German Shepradors are not a great choice for novice pet owners, but if you’re looking for a watch dog and family companion, please step right up! Big homes with yards are ideal but not required, as long as they exercise. While Shepradors are not excessively barky they will alert when strangers approach. They’re protective of their loved ones and friendly with people, children, and other dogs. Don’t leave them alone for long periods, though, or else they may become bored and destructive. Read on to learn more about the German Sheprador.",L,,,,,,,,,
German Shorthaired Pointer,"This versatile sporting dog breed hunts many types of game, retrieves on land or from water, and is an affectionate companion. He has a striking, easy-care coat, but he needs plenty of vigorous exercise. If you can provide him with the mental and physical challenges he craves, he’ll be your best four-legged friend.",M,,,,,,,,,
German Spitz,"The German Spitz is one of the oldest dog breeds originating from Europe. Attentive, energetic, and devoted, these pups have some of the best qualities among any dog breed around.

German Spitzes go by several other names such as Spitz, German Spitz Mittelspitz, and Deutscher Spitz. If you’d like to bring home a dog of this breed, look for them at your local shelter or rescue. Remember, adopt a pup, and don’t shop!


These adorable pooches can make great apartment dogs due to their small stature and are suited for any type of household or family, though they have a tendency to be yappy. If you want an energetic “firecracker” dog who will keep you on your toes, alert you to any potential dangers, and love you unconditionally, this may be the right dog for you!",S,,,,,,,,,
German Wirehaired Pointer,"The German Wirehaired Pointer was developed in the late 19th and early 20th centuries to be a versatile hunting dog breed, a job at which he still excels today. He can hunt any game on any terrain and point and retrieve from land or water. His excellent nose and stamina are appreciated by hunters worldwide, and he’s also a great companion for active families who can provide an outlet for his high energy level.",L,,,,,,,,,
Giant Schnauzer,"The Giant Schnauzer was created to be a working dog breed, so he has intelligence and drive. He can be a loyal and courageous companion for the person who can provide him with the training, exercise, and attention he needs.",L,,,,,,,,,
Glen of Imaal Terrier,"The Glen of Imaal Terrier is a strong, independent dog breed named for the remote valley in Ireland where he originated. Bred to hunt fox and badger, and to keep homes free of rodents, the Glen is a skilled and cunning hunter. He’s also an affectionate family dog, gentle and loving with his people.",S,,,,,,,,,
Goberian,"The Goberian is a mixed breed dog–a cross between the Golden Retriever and Siberian Husky dog breeds. Friendly, energetic, and smart, these pups inherited some of the best qualities from both of their parents.

You can find these mixed breed dogs in shelters and breed-specific rescues, so remember to always adopt! Don’t shop if you’re looking to add a Goberian to your home!


Goberians make for great family dogs. They are extremely friendly, renowned for their good temperament, and enjoy being around people. The devoted mixed breed is an excellent companion and will come to look on you and your family as their best friends. However, you’ll need to make sure you provide adequate exercise for your Goberian to ward off any antisocial habits–this is a dog breed that loves to go hiking, jogging and take extended trips to the local dog park. Such an active breed is not a good fit for an apartment dweller.",M,,,,,,,,,
Goldador,"Loving, devoted, and energetic, Goldador mixed-breed dogs are prized for their good-natured trainability. They make great family members — a natural with kids and social with other pets — as well as valuable guide, service, and bomb detection dogs.",L,,,,,,,,,
Golden Cocker Retriever,"The Golden Cocker Retriever is a mixed breed dog–a cross between the Golden Retriever and Cocker Spaniel dog breeds. Sweet, playful, and intelligent, these pups inherited some of the best qualities from both of their parents.

Golden Cocker Retrievers also go by the names Cogol and Dakota Sport Retriever. You can find these mixed breed dogs in shelters and breed-specific rescues, so remember to always adopt! Don’t shop if you’re looking to add a one of these sweet pups to your home!


The Golden Cocker Retriever is a super affectionate and extra playful pooch. This is a mixed breed that makes for a top notch family dog–the’ll want to be involved in all of your daily activities, whether that’s snuggling and lounging on the couch or heading out on hikes and running errands. Although speaking about activities, the Golden Cocker Retriever is an energetic breed that will require a high amount of exercise–this is not an apartment dog.",M,,,,,,,,,
Golden Mountain Dog,"The Golden Mountain Dog is a mixed breed dog–a cross between the Golden Retriever and Bernese Mountain Dog breeds. Gentle, friendly and intelligent, these pups inherited some of the best qualities from both of their parents.

You can find these mixed breed dogs in shelters and breed specific rescues, so remember to always adopt! Don’t shop if you’re looking to add a Golden Mountain Dog to your home!


If you’re a fan of larger-than-life dogs but are also looking for a mixed breed that’s very much a gentle giant, the Golden Mountain Dog is for you. The mixed breed makes an excellent family dog and gets along great with small children and other family pets alike. They’re loyal, affectionate, highly intelligent, and willing to please. Just take note: They definitely prefer living in places where the weather is on the colder side, and definitely aren’t apartment dogs.",L,,,,,,,,,
Golden Retriever,"The Golden Retriever is one of the most popular dog breeds in the U.S. The breed’s friendly, tolerant attitude makes them fabulous family pets, and their intelligence makes them highly capable working dogs.

Golden Retrievers excel at retrieving game for hunters, tracking, sniffing out contraband for law enforcement, and as therapy and assistance dogs. They’re also natural athletes, and do well in dog sports such as agility and competitive obedience.",L,,,,,,,,,
Goldendoodle,"The Goldendoodle is a “designer dog,” a hybrid dog breed resulting from breeding a Poodle with a Golden Retriever. Like all other designer “breeds,” the Goldendoodle is not truly a breed of its own, but is a crossbreed—and in this case, a cross that is enjoying growing popularity.",M,,,,,,,,,
Gollie,"The Gollie is a mixed breed dog–a cross between the Golden Retriever and Collie dog breeds. Loving, clever, and energetic, these pups inherited some of the best qualities from both of their parents.

Gollies are also sometimes known as Golden Collies. You can find these mixed breed dogs in shelters and breed specific rescues, so remember to always adopt! Don’t shop if you’re looking to add one of these mixed breed dogs to your home!


Gollies totally love people and will become a loving and faithful part of your family. Beyond snuggle sessions, be aware that the breed is also a very active one. This is not an apartment dog, and walks and outdoor time need to be on the brisk and energetic side. If you like jogging or hiking, consider the Gollie to be your new training partner!",L,,,,,,,,,
Gordon Setter,"Originally bred to hunt pheasant and quail, Gordon Setters are still fine hunting companions and field trial competitors. Canines of this dog breed also compete in obedience, conformation, and agility and are a terrific family and companion dog.",L,,,,,,,,,
Great Dane,"Oh, baby! A Great Dane is truly a great dog breed — large and noble, commonly referred to as a gentle giant or as the “Apollo of dogs.” Apollo is the Greek god of the sun, the brightest fixture in the sky. The Great Dane certainly holds stature in the dog world; but though he looks terribly imposing, in reality he’s one of the best-natured dogs around. For all of his size, a Great Dane is a sweet, affectionate pet. He loves to play and is gentle with children.",M,,,,,,,,,
Great Pyrenees,"The Great Pyrenees dog breed‘s goal in life is to protect sheep, goats, livestock, people, children, grass, flowers, the moon, the lawn furniture, bird feeders, and any real or imaginary predators that may intrude on your personal space. Oh yeah, and to give, give, and give unconditional love. Anyone who has seen this stunning white dog becomes enamored. What’s not to like? He has a strong build, a beautiful, thick coat, and he exudes elegance and majesty. One look and you can see the intelligence and steady temperament that many seek in a good family dog.",L,,,,,,,,,
Greater Swiss Mountain Dog,"The Greater Swiss Mountain dog breed was developed to be an all-around working dog, herding cattle, pulling carts, and standing guard. These days, the Swissy enjoys life as a family pet, but because of his working heritage, he enjoys being busy. This powerful breed excels in all sorts of dog sports, from agility to weight pulling.",L,,,,,,,,,
Greyhound,"Greyhounds were originally bred as hunting dogs to chase hare, foxes, and deer. Canines in this dog breed can reach speeds of 40 to 45 miles per hour, making them the Ferraris of the dog world. Not surprisingly, Greyhounds made a name for themselves as racing dogs and are still used in racing today. They also participate in many other dog sports, including lure coursing, conformation, obedience, and agility. Beyond their grace and speed, people love them for their sweet, mild nature.",L,,,,,,,,,
Harrier,"Harriers originally were bred to hunt hares and foxes. Today, the dog breed isn’t especially popular, but his excellent sense of smell and tireless work ethic makes him a great fit for hunters.",M,,,,,,,,,
Havanese,"The Havanese dog breed has won many admirers with his long, silky hair, expressive eyes, and cuddly size. Bred as a companion dog to the Cuban aristocracy in the 1800s, he’s earned the nickname “Velcro dog” because he sticks so closely to his owner’s side. But don’t write him off as just a lapdog; the Havanese is trainable and surprisingly energetic, and has excelled in dog sports and canine careers ranging from circus performer to assisting the handicapped.",S,,,,,,,,,
Hokkaido,"The Hokkaido is a purebred dog from Japan. Intelligent, alert, and devoted to their families, these pooches have qualities that make them excellent companions.

The Hokkaido goes several names, including Ainu-ken, Seta, and Ainu dog. In Japan specifically, their name is shortened to Do-ken. Though this breed is somewhat rare outside of Japan, you can still find these purebred dogs in shelters and breed specific rescues, so remember to adopt! Don’t shop!


These beautiful dogs can live in apartments and townhomes, as they are a medium-sized breed. But they are also quite active and would prefer a home with a yard or nearby park where they can walk and play. Hokkaidos get along in any household type, from single folks to large families. They also get along with children when raised with them or socialized properly at an early age. They’re alert to their surroundings and completely loyal, which might make them the perfect dog for you!",M,,,,,,,,,
Horgi,"The Horgi is a mixed breed dog–a cross between the Siberian Husky and Corgi dog breeds. Small, playful and full of energy, these pups inherited some of the best qualities from both of their parents.

Horgis are also called Siborgis. Despite their unfortunate status as a designer breed, you can find these mixed-breed dogs in shelters and breed specific rescues, so remember to adopt! Don’t shop!


These adorable pups make great additions to people and families who enjoy the great outdoors. They have a lot of energy and would thrive in an active household with a secure yard. If you like walking and would like a companion to walk with you, this may be your new best friend. They have pack-dog heritage and would fit in nicely to multiple dog homes. Read on to find out if the Horgi is the right dog for you!",S,,,,,,,,,
Ibizan Hound,"The Ibizan Hound was originally bred to hunt rabbits and small game on the Balearic island of Ibiza. Today, the Ibizan Hound dog breed is still used in that capacity in Spain and elsewhere. Ibizan Hounds also compete in lure coursing, agility, obedience, conformation, and tracking, in addition to being much-loved family companions.",S,,,,,,,,,
Icelandic Sheepdog,"Thought to be companions to the ancient Vikings, the Icelandic Sheepdog dog breed was used to protect flocks, especially lambs, from birds of prey.

They still retain the habit of watching the sky and barking at birds–as well as everything else they see or hear.",M,,,,,,,,,
Irish Red and White Setter,"The Red and White Irish Setter dog breed barely escaped extinction when most breeders began focusing on the all-red varieties. Now they’re considered a separate breed from their Irish Setter cousins. As gundogs, they’re slow to train but eventually become loyal and reliable hunters.",M,,,,,,,,,
Irish Setter,"Irish Setters originated as a gundogs in their native Ireland, and the dog breed‘s popularity soon spread, thanks to the beauty of their rich mahogany coat and their enthusiasm as bird dogs.

They’re friendly, mischievous, and inquisitive, with a high energy level. This is a bold and boisterous family friend with the potential to do well in many canine sports and activities.",L,,,,,,,,,
Irish Terrier,"The Irish Terrier dog breed was once described as the “poor man’s sentinel, the farmer’s friend, and the gentleman’s favorite.” Rugged and stouthearted, he has the advantages of a convenient size, versatile abilities as a companion, watchdog, and vermin dispatcher, and high train-ability.",M,,,,,,,,,
Irish Water Spaniel,"Whether he’s splashing after ducks or showing off in the agility ring, canines in the Irish Water Spaniel dog breed do everything with a sense of fun. Created in Ireland as a water retriever, he’s rare these days, but makes an excellent companion for active and experienced dog owners — especially if they live near a body of water.",L,,,,,,,,,
Irish Wolfhound,"The Irish Wolfhound dog breed was originally used in war to drag men off horses and chariots. He also hunted large game such as deer, boar, and wolves. Today this adaptable dog is a family companion who also competes in obedience, tracking, and lure coursing.",M,,,,,,,,,
Italian Greyhound,"The Italian Greyhound dog breed was a favorite companion of noblewomen in the Middle Ages, especially in Italy. But this small hound was more than a lap dog, having the speed, endurance, and determination to hunt small game. These days, he’s a family dog whose beauty and athleticism is admired in the show ring and in obedience, agility, and rally competitions.",S,,,,,,,,,
"
Jack Chi","The Jack Chi is a mixed breed dog–a cross between the Jack Russell Terrier and Chihuahua dog breeds. Friendly, playful, and energetic, these pups inherited some of the best qualities from both of their parents.

The Jack Chi is also sometimes called the Jackahuahua and the Jackhuahua. You can find these mixed breed dogs in shelters and breed specific rescues, so remember to always adopt! Don’t shop if you’re looking to add one of these pups to your home!


These adorable mixed breed dogs make great low-maintenance companions. They’re sweet and playful and always super fun to have around. Also, this mixed breed is totally fine living in apartment situations, and most are pretty quiet dogs without any yapping tendencies.",S,,,,,,,,,
Jack Russell Terrier,"Developed in England some 200 years ago to hunt foxes, the Jack Russell Terrier, also known as the Parson Russell Terrier, is a lively, independent, and clever little dog. He’s charming and affectionate, but he’s also a handful to train and manage. For experienced dog owners only!",S,,,,,,,,,
Japanese Chin,"The Japanese Chin dog breed hails from Asia, where he has been prized as a companion for more than a thousand years. He was a popular member of Chinese and Japanese imperial courts, and it was in Japan that his distinctive look was developed. This breed is elegant and dainty, mild-mannered and playful.",S,,,,,,,,,
Japanese Spitz,"The Japanese Spitz is a small family companion with the heart of a large watchdog. This breed may look similar to American Eskimo Dogs, white Pomeranians, or small Samoyeds, but Japanese Spitz dogs have their own lineages and hail from, as you might guess, Japan. Although this breed is not recognized by the American Kennel Club, it is accepted by many other kennel clubs around the world.

Japanese Spitz dogs are also intelligent, easy to train, low-maintenance, and great with children. They make good apartment dogs, so long as owners meet their exercise needs, and they have fairly low grooming needs, despite the appearance of their gorgeous, white fur. Dogs of this breed are protective of their human families, even though they are small in stature, and they are known to bark when strangers enter their territory without backing down. If you want a dog that will be a dedicated family member with spirit and personality that far exceed their physical size, the Japanese Spitz might be the pooch for you.",S,,,,,,,,,
Korean Jindo Dog,"Originating in South Korea, the Korean Jindo Dog exhibits unmatched loyalty. They are also incredibly intelligent dogs with a knack for hunting, tricks, and even agility. Fastidious and quiet indoors, they make great household pets and companions.

Jindos require strong training, patience, and plenty of long walks. However, this makes them a good fit for active individuals and families who have enough time to let their wonderful personalities shine through. If you want a faithful friend who will learn quickly and love every member of your household, then the Korean Jindo Dog may be right for you.",M,,,,,,,,,
Karelian Bear Dog,"The Karelian Bear Dog, called Karjalankarhukoira in the breed’s native Finland, is a strong, alert, and fearless breed that is capable of hunting or treeing small-to-large game–even aggressive game such as bears, lynxes, wild boars, wolves, and moose. It makes the list of the top ten most common dog breeds in Finland, where people consider the Karelian Bear Dog a national treasure.

Karelian Bear Dogs were bred to be naturally aggressive to other animals for hunting purposes. For that reason, it takes a good deal of socialization and training to keep them as household companions. Also, they have high energy and exercise requirements.


However, Karelian Bear Dogs, are extremely loyal to their human families and are very protective watchdogs. So, for an owner willing to put in the work, socialize, train diligently, and give plenty of open space and physical activity, the Karelian Bear Dog can be a calm, loving family member.",M,,,,,,,,,
Keeshond,"The Keeshond is an old dog breed, once a companion and watchdog on the barges and boats that traveled the canals and rivers of Holland in the 17th and 18th centuries. He’s almost exclusively a companion dog today. He’s a people-lover; willing to participate in all family activities, he thrives with people who expect this of their dog. He is lively, alert, and intelligent — qualities that won him status as the most beloved dog in Holland.",S,,,,,,,,,
